{
  "schema_version": "1.0",
  "graph_kind": "catalog_and_governance",
  "prepared_on": "2026-10-23",
  "source_registry_sha256": "9e44a8862df3046a86712fecd873377fe66c04ffb0c022cd5d81942820cc028d",
  "source_registry_version": "0.1-draft",
  "scope": "catalog_structure_and_unresolved_policy_requirements",
  "scientific_join_count": 0,
  "authorization_grant_count": 0,
  "network_requests_in_build": 0,
  "nodes": [
    {
      "id": "collection:gee:COPERNICUS/S2_SR_HARMONIZED",
      "kind": "Product",
      "label": "Sentinel-2 harmonized surface reflectance",
      "status": "catalog_entry",
      "authorization_granted": false,
      "evidence": {
        "registry_pointer": "/products/6",
        "registry_sha256": "9e44a8862df3046a86712fecd873377fe66c04ffb0c022cd5d81942820cc028d",
        "documentation_urls": [
          "https://developers.google.com/earth-engine/datasets/catalog/COPERNICUS_S2_SR_HARMONIZED"
        ],
        "level": "curated_registry_reference_not_live_verification"
      },
      "attributes": {
        "service_id": "service:earth-engine",
        "native_id": "COPERNICUS/S2_SR_HARMONIZED",
        "asset_version_required": true,
        "record_policy_required": true,
        "documentation_url": "https://developers.google.com/earth-engine/datasets/catalog/COPERNICUS_S2_SR_HARMONIZED",
        "review_state": "catalog_documentation_reviewed_record_terms_pending"
      }
    },
    {
      "id": "collection:gee:GOOGLE/SATELLITE_EMBEDDING/V1/ANNUAL",
      "kind": "Product",
      "label": "Satellite Embedding V1 annual",
      "status": "catalog_entry",
      "authorization_granted": false,
      "evidence": {
        "registry_pointer": "/products/5",
        "registry_sha256": "9e44a8862df3046a86712fecd873377fe66c04ffb0c022cd5d81942820cc028d",
        "documentation_urls": [
          "https://developers.google.com/earth-engine/datasets/catalog/GOOGLE_SATELLITE_EMBEDDING_V1_ANNUAL"
        ],
        "level": "curated_registry_reference_not_live_verification"
      },
      "attributes": {
        "service_id": "service:earth-engine",
        "native_id": "GOOGLE/SATELLITE_EMBEDDING/V1/ANNUAL",
        "asset_version_required": true,
        "record_policy_required": true,
        "documentation_url": "https://developers.google.com/earth-engine/datasets/catalog/GOOGLE_SATELLITE_EMBEDDING_V1_ANNUAL",
        "review_state": "catalog_documentation_reviewed"
      }
    },
    {
      "id": "collection:gee:LANDSAT/LC08/C02/T1_L2",
      "kind": "Product",
      "label": "Landsat 8 Collection 2 Level 2",
      "status": "catalog_entry",
      "authorization_granted": false,
      "evidence": {
        "registry_pointer": "/products/4",
        "registry_sha256": "9e44a8862df3046a86712fecd873377fe66c04ffb0c022cd5d81942820cc028d",
        "documentation_urls": [
          "https://developers.google.com/earth-engine/datasets/catalog/LANDSAT_LC08_C02_T1_L2"
        ],
        "level": "curated_registry_reference_not_live_verification"
      },
      "attributes": {
        "service_id": "service:earth-engine",
        "native_id": "LANDSAT/LC08/C02/T1_L2",
        "asset_version_required": true,
        "record_policy_required": true,
        "documentation_url": "https://developers.google.com/earth-engine/datasets/catalog/LANDSAT_LC08_C02_T1_L2",
        "review_state": "catalog_documentation_reviewed"
      }
    },
    {
      "id": "environment:gcp-project-template",
      "kind": "Environment",
      "label": "GCP project (unconfigured template)",
      "status": "catalog_entry",
      "authorization_granted": false,
      "evidence": {
        "registry_pointer": "/environments/0",
        "registry_sha256": "9e44a8862df3046a86712fecd873377fe66c04ffb0c022cd5d81942820cc028d",
        "documentation_urls": [],
        "level": "curated_registry_reference_not_live_verification"
      },
      "attributes": {
        "type": "CloudProjectEnvironment",
        "provider_id": "org:google",
        "service_id": "service:earth-engine",
        "project_ref": null,
        "visibility": "private_operational_overlay",
        "registration_state": "must_verify_actual_project",
        "iam_state": "must_verify_per_actor",
        "residency_state": "unknown_until_documented",
        "quota_and_cost_ceiling": null,
        "export_destination_ref": null,
        "authorization_granted": false,
        "provisioned_by_this_plan": false
      }
    },
    {
      "id": "org:cbp",
      "kind": "Organization",
      "label": "Chesapeake Bay Program",
      "status": "catalog_entry",
      "authorization_granted": false,
      "evidence": {
        "registry_pointer": "/providers/4",
        "registry_sha256": "9e44a8862df3046a86712fecd873377fe66c04ffb0c022cd5d81942820cc028d",
        "documentation_urls": [],
        "level": "curated_registry_reference_not_live_verification"
      },
      "attributes": {
        "type": "Organization"
      }
    },
    {
      "id": "org:eol",
      "kind": "Organization",
      "label": "Encyclopedia of Life",
      "status": "catalog_entry",
      "authorization_granted": false,
      "evidence": {
        "registry_pointer": "/providers/3",
        "registry_sha256": "9e44a8862df3046a86712fecd873377fe66c04ffb0c022cd5d81942820cc028d",
        "documentation_urls": [],
        "level": "curated_registry_reference_not_live_verification"
      },
      "attributes": {
        "type": "Organization"
      }
    },
    {
      "id": "org:google",
      "kind": "Organization",
      "label": "Google",
      "status": "catalog_entry",
      "authorization_granted": false,
      "evidence": {
        "registry_pointer": "/providers/9",
        "registry_sha256": "9e44a8862df3046a86712fecd873377fe66c04ffb0c022cd5d81942820cc028d",
        "documentation_urls": [],
        "level": "curated_registry_reference_not_live_verification"
      },
      "attributes": {
        "type": "Organization"
      }
    },
    {
      "id": "org:jgi",
      "kind": "Organization",
      "label": "DOE Joint Genome Institute",
      "status": "catalog_entry",
      "authorization_granted": false,
      "evidence": {
        "registry_pointer": "/providers/7",
        "registry_sha256": "9e44a8862df3046a86712fecd873377fe66c04ffb0c022cd5d81942820cc028d",
        "documentation_urls": [],
        "level": "curated_registry_reference_not_live_verification"
      },
      "attributes": {
        "type": "Organization"
      }
    },
    {
      "id": "org:ncbi",
      "kind": "Organization",
      "label": "NCBI at NLM NIH",
      "status": "catalog_entry",
      "authorization_granted": false,
      "evidence": {
        "registry_pointer": "/providers/2",
        "registry_sha256": "9e44a8862df3046a86712fecd873377fe66c04ffb0c022cd5d81942820cc028d",
        "documentation_urls": [],
        "level": "curated_registry_reference_not_live_verification"
      },
      "attributes": {
        "type": "Organization"
      }
    },
    {
      "id": "org:neon",
      "kind": "Organization",
      "label": "NEON operated by Battelle",
      "status": "catalog_entry",
      "authorization_granted": false,
      "evidence": {
        "registry_pointer": "/providers/1",
        "registry_sha256": "9e44a8862df3046a86712fecd873377fe66c04ffb0c022cd5d81942820cc028d",
        "documentation_urls": [],
        "level": "curated_registry_reference_not_live_verification"
      },
      "attributes": {
        "type": "Organization"
      }
    },
    {
      "id": "org:noaa",
      "kind": "Organization",
      "label": "NOAA",
      "status": "catalog_entry",
      "authorization_granted": false,
      "evidence": {
        "registry_pointer": "/providers/0",
        "registry_sha256": "9e44a8862df3046a86712fecd873377fe66c04ffb0c022cd5d81942820cc028d",
        "documentation_urls": [],
        "level": "curated_registry_reference_not_live_verification"
      },
      "attributes": {
        "type": "Organization"
      }
    },
    {
      "id": "org:odu",
      "kind": "Organization",
      "label": "ODU or verified data custodian",
      "status": "catalog_entry",
      "authorization_granted": false,
      "evidence": {
        "registry_pointer": "/providers/5",
        "registry_sha256": "9e44a8862df3046a86712fecd873377fe66c04ffb0c022cd5d81942820cc028d",
        "documentation_urls": [],
        "level": "curated_registry_reference_not_live_verification"
      },
      "attributes": {
        "type": "Organization"
      }
    },
    {
      "id": "org:pangaea",
      "kind": "Organization",
      "label": "PANGAEA",
      "status": "catalog_entry",
      "authorization_granted": false,
      "evidence": {
        "registry_pointer": "/providers/8",
        "registry_sha256": "9e44a8862df3046a86712fecd873377fe66c04ffb0c022cd5d81942820cc028d",
        "documentation_urls": [],
        "level": "curated_registry_reference_not_live_verification"
      },
      "attributes": {
        "type": "Organization"
      }
    },
    {
      "id": "org:usgs",
      "kind": "Organization",
      "label": "USGS",
      "status": "catalog_entry",
      "authorization_granted": false,
      "evidence": {
        "registry_pointer": "/providers/6",
        "registry_sha256": "9e44a8862df3046a86712fecd873377fe66c04ffb0c022cd5d81942820cc028d",
        "documentation_urls": [],
        "level": "curated_registry_reference_not_live_verification"
      },
      "attributes": {
        "type": "Organization"
      }
    },
    {
      "id": "org:virginia-custodian-unconfirmed",
      "kind": "Organization",
      "label": "Actual Virginia data custodian must be identified",
      "status": "catalog_entry",
      "authorization_granted": false,
      "evidence": {
        "registry_pointer": "/providers/10",
        "registry_sha256": "9e44a8862df3046a86712fecd873377fe66c04ffb0c022cd5d81942820cc028d",
        "documentation_urls": [],
        "level": "curated_registry_reference_not_live_verification"
      },